id,name,desc,bravery,CAPTURE,PATROL,INTERCEPT,ASSAULT,DEFEND,STRIKE,HARASS,FIRE_SUPPORT,CARRIER_GROUP,CIVILIAN_CRAFT,STRIKE_FORCE,LIGHT_ESCORT,DESTROYER_ESCORT
timid,소심한,전투에서 이 장교는 전투함을 지휘하더라도 가능하다면 직접적인 교전을 피하려고 노력할 것입니다.,5,0.5,0.5,0.1,0,1,0,0,3,3,3,1,1,1
cautious,조심스런,"전투에서 이 장교는 적의 범위를 벗어나는 것을 선호하며, 적의 범위를 벗어나는 경우에만 가끔씩 접근합니다.",5,1,0.7,0.3,0.3,2,0.3,0.3,2,2,2,1,1,1
steady,신중한,전투에서 이 장교는 현재 상황에 맞는 전술을 사용하여 균형 잡힌 접근 방식을 선호합니다.,5,1,1,1,1,1,1,1,1,1,1,1,1,1
aggressive,공격적인,"전투에서 이 장교는 함선의 모든 무기를 사용할 수 있는 거리에서 교전하는 것을 선호하고, 민간 함선을 마치 전투함인 것처럼 조종하며, 자신의 지휘하에 있는 전투기를 공격적으로 고용합니다.",5,1.5,1,2,2,0.5,2,2,0.5,0.5,0.5,1,0.5,0.5
reckless,무모한,전투에서 이 장교는 적과 교전하기 위해 함선의 안전을 완전히 무시하며 실수에 대해 공격적입니다.,5,1.5,1,2,2,0.5,2,2,0.5,0.5,0.5,1,0.5,0.5
